,product,company,price
0,GOOJODOQ For iPad Air 2 1 Case 9.7 Funda Silicone Soft Back Pu Leather Case for iPad,GOOJODOQ Official Store,US $8.17 - 9.01
1,zimoon Case for Apple iPad 2 3 4 Magnetic Auto Wake Up Sleep Flip for iPad 2/3/4,zimoon store,US $7.54
2,"bigmzpai Smart Case For Huawei MediaPad T3 10 9.6""AGS-L09 W09 Tablet Flip pu Leather",bigmzpai iHOPE DIGITAL Store,US $6.28 - 6.34
3,Ultra Slim Smart Flip Stand PU Leather Cover Case For Apple iPad Mini 1 2 3 Retina,Enjoying+o Store,US $3.91 - 5.08
4,OLPAY 1Pcs For iPad Mini 1 Mini 2 A1432 A1454 A1455 Touch Screen Digitizer,CoBala Store,US $9.97
5,GOOJODOQ Case for iPad 2 3 4 Silicone Soft Back Folio Stand for iPad 2 Case,GOOJODOQ Official Store,US $8.39 - 9.32
6,BENCUS Magnetic Smart Cover Case For Amazon 2018 Released funda For Kindle Paperwhite,BENCUS 3C Store,US $5.42 - 7.56
7,SHENGMEIYU For capa amazon kindle paperwhite 1/2/3 cover Ultra Slim Case for Tablet,Changliang Store ,US $3.35 - 3.79
8,"MyDuoDuo Litchi Pattern Tablet For Samsung Galaxy Tab E 9.6"" T560 SM-T561 Protective",PadHome Store,US $6.09 - 6.21
9,iBuyiWin Case for Xiaomi Mi Pad 4 Slim Retro Folding Stand PU Leather Smart Cover,Baisen Digital Store,US $7.37 - 8.25
10,MiOYOOW For Amazon Kindle Paperwhite 1 2 3 Silm Foldable Cover 6'' Smart Case for,MiOYOOW Store,US $3.51 - 3.78
11,GOLP Case for iPad Air Flip Stand 5 6 2018 PU leather Full for ipad air 2 smart cover,GOLP Direct Store,US $7.69
12,ESR Case for iPad Mini 5 2019 Yippee Trifold Smart Auto Sleep/Wake Case for iPad Mini,ESR Official Store,US $9.89
13,CARPRIE Magnetic Auto Sleep Slim Cover Case Hard Shell For KOBO GLO HD 6.0inch,High Tech Paradise Store,US $6.18
14,MyDuoDuo Tablet Case for Samsung Galaxy Tab A A6 10.1 2016 T585 T580 SM-T580 T580N,PadHome Store,US $6.20 - 6.36
15,GARUNK for Samsung Galaxy Tab A A6 10.1 2016 SM-T580 T580N T585 Leather Protective,GARUNK Official Flagship Store,US $6.55 - 7.22
16,Perciron For Samsung Galaxy Tab 3 SM-T110 SM-T111 SM-T113 SM-T116 Touch Screen panel,LCD China Store,US $6.80 - 13.90
17,iBuyiWin 360 Rotating Case for Samsung Galaxy Tab A 10.1 2016 T580 T585 Stand Cover,Baisen Factory Store,US $6.59 - 7.59
18,YPAY For P550 SM-T550 SM-T555 SM-P550 Tablet Case Bracket Flip For Samsung Galaxy,YPAY Official Store,US $6.46
19,MeasMate Tempered Glass for Samsung Galaxy Tab A A6 10.1 2016 for Galaxy Tab A,"Unifone Co.,Ltd",US $2.99 - 3.99
20,GARUNK for Samsung Galaxy Tab 2 10.1 inch GT-P5100 P5110 P5113 Leather Protective,GARUNK Official Flagship Store,US $7.16
21,IRALAN Retro Leather Smart Case For Huawei MediaPad M5 10.8 CMR-AL09 CMR-W09/ 10 Pro,shenzhen-3c- Store,US $9.79
22,iBuyiWin Tablet for Samsung Galaxy Tab E 9.6 T560 T561 Slim Folding Case for Samsung,Baisen Factory Store,US $6.47 - 6.97
23,AIEACH Cover For New iPad 9.7 inch 2018 With Pencil Holder Silicone Case For iPad,AIEACH Official Store,US $10.35 - 11.31
24,centechia Arctic Cooling MX-4 Thermal Compound Paste Tube for PC XBOX 360 PS3 ND998,ND 3C Store,US $4.53 - 27.79
25,YPAY A10-30F TB2 X30L X30F Tablet 10.1'' Delicate Kickstand Case For Lenovo Tab,YPAY Official Store,US $6.64
26,BENCUS Ultra Slim Stand Cover For Lenovo tab 10 TB-X103F 2 A10-70 2 A10-30,BENCUS 3C Store,US $9.96 - 10.94
27,MeasMate for Huawei MediaPad M5 Lite 10 BAH2-W19/L09/W09 Pu Leather Cover for Case,Cesapay Online Store,US $3.99 - 6.74
28,cover case for Lenovo Tab 4 8inch TB-8504F/8504N 8 inch Tablet release Protective,Walkers Technology E-readers Cover,US $6.55 - 7.87
29,HISTERS Stylus Screen Protector for Irbis Case,RU VIP Store,US $6.58 - 8.30
30,RV77 2016 10mm*10mm*1mm 100 pcs Thermal Pad GPU CPU Heatsink Cooling Conductive,faker kb Store,US $1.21
31,Maymiky Case For Samsung Galaxy Tab A A6 10.1 T580 T585 T580N SM-T580 Cover,Baolai 3C Store,US $6.43
32,Myslc Rotating Universal Cover for Prestigio MultiPad Wize 3171 3161 3151 3131 3401,Good discount on Friday Store,US $7.62
33,"srjtek 9.7"" Touch Screen For iPad 3 4 iPad3 iPad4 A1416 A1430 A1403 Panel",SRJTECH Store,US $8.90 - 9.60
34,Kazerwa For Huawei Media MediaPad T3 10 AGS-WO9 AGS-L09 9.6 inch Honor Play Pad 2,Shop3293002 Store,US $7.12 - 11.42
35,iBuyiWin Case for Lenovo Tab 4 10 TB-X704N TB-X704F TB-X704L Case for Lenovo TAB4,Baisen Digital Store,US $6.89 - 7.78
36,MeasMate 360 Degrees Rotating PU Leather Flip Cover Case for iPad 2 3 4 Stand Cases,iBuy Inc Tablet Accessory Store,US $4.06 - 7.87
37,Slim Case for Kobo Clara HD 6 Inch Ebook Smart Cover Ereader Skin Shell Protector,Walkers Technology E-readers Cover,US $6.64 - 6.99
38,IRALAN 360 Rotating Case for Huawei MediaPad T3 10 AGS-W09 AGS-L09 AGS-L03 Cover for,shenzhen-3c- Store,US $6.87 - 7.14
39,ARCTIC MX-4 2g 4g 8g 20g AMD Intel processor CPU Cooler Cooling Fan Thermal Grease,Yao Yue Store,US $6.50 - 25.00
40,Helloplanet For Samsung Galaxy Tab S2 9.7 inch T810 T813 T815 T819 SM-T810 Leather,Helloplanet,US $6.99 - 7.99
41,afesar SM-T710 T715 T713 T719 Ultra Slim case for Samsung galaxy Tab S2 8.0,Good friendly Store,US $8.45 - 8.92
42,PFHEU Case for New iPad 9.7 inch 2018 Release model A1822 A1823 A1893A1954 silicone,PFHEU Store,US $8.12
43,srjtek SM T280 For Samsung Galaxy Tab 7.0 2016 LCD Touch Screen Digitizer Assembly 7,Alcd Store,US $20.71
44,Ninth World 120mm PC Computer 16dB Ultra Silent 15 LEDs Case Heatsink Cooler Fan,Good product Store,US $1.19 - 3.68
45,SILVER LINK Case Soft Silicon Skin Cover For Kindle Paperwhite 1/2/3 E-Book Auto,SILVER LINK Store,US $4.92
46,"AINIYO For CHUWI hi9 plus Stand Pu Leather Cover hi9plus 10.8"" Tablet PC protective",AINIYO Official Store,US $9.65 - 13.74
47,Afesar for Tab S3 9.7 SM T820 T825 Smart Cover Slim Light Case for Samsung Galaxy,Good friendly Store,US $9.27 - 9.92
